{
  "schemaVersion": 1,
  "exerciseId": "LUNGE",
  "exerciseName": "Forward Bodyweight Lunge",
  "exerciseVariant": "FORWARD_BODYWEIGHT",
  "equipment": [
    "NONE"
  ],
  "trainingLevel": "COACH_ADAPTED",
  "referenceSources": [
    {
      "sourceId": "ACE_FORWARD_LUNGE",
      "title": "ACE Forward Lunge",
      "url": "https://www.acefitness.org/resources/everyone/exercise-library/94/forward-lunge/",
      "publisher": "American Council on Exercise",
      "accessedAt": "2026-10-31",
      "summary": "Mô tả bước ra trước, hạ hông trong phạm vi thoải mái và trở lại đứng; cần kiểm soát chuyển động thân và chân trụ.",
      "scope": "EXERCISE_COACHING_REFERENCE",
      "providesValidatedComputerVisionThresholds": false
    },
    {
      "sourceId": "MEDIAPIPE_POSE",
      "title": "Pose landmark detection guide",
      "url": "https://developers.google.com/edge/mediapipe/solutions/vision/pose_landmarker",
      "publisher": "Google AI Edge",
      "accessedAt": "2026-10-31",
      "summary": "Pose Landmarker dự đoán vị trí khớp theo ảnh/video; output không tự xác nhận kỹ thuật hay lực lên khớp.",
      "scope": "MEASUREMENT_TECHNOLOGY_NOT_TECHNIQUE_STANDARD",
      "providesValidatedComputerVisionThresholds": false
    }
  ],
  "approvedByCoach": null,
  "approvedAt": null,
  "approvedStandardDigest": null,
  "standardVersion": "forward-lunge-1.0.0-draft",
  "status": "EXPERIMENTAL",
  "startingPosition": {
    "reference": "Đứng, chuẩn bị bước ra trước; camera phải thấy cả chân trụ và chân bước.",
    "requiredLandmarks": [
      "Ankle",
      "Hip",
      "Knee",
      "Shoulder"
    ],
    "detectionConditions": [
      "Nhận diện từ đoạn frame liên tục phù hợp, không chỉ frame đầu.",
      "Tách điều kiện khởi tạo đo với điều kiện kết luận kỹ thuật."
    ]
  },
  "movementPhases": [
    {
      "phaseId": "PREPARE",
      "description": "Đứng chuẩn bị bước."
    },
    {
      "phaseId": "STEP",
      "description": "Bước ra trước."
    },
    {
      "phaseId": "DESCENT",
      "description": "Hạ người trong phạm vi phù hợp."
    },
    {
      "phaseId": "ASCENT",
      "description": "Đẩy trở lại."
    },
    {
      "phaseId": "FINISH",
      "description": "Trở lại đứng."
    }
  ],
  "criteria": [
    {
      "criterionId": "LUNGE-01",
      "criterionName": "Góc gối quan sát",
      "type": "A",
      "description": "Đo bên nhìn rõ; chưa xác nhận chân trước tự động.",
      "applicableExerciseVariants": [
        "FORWARD_BODYWEIGHT"
      ],
      "requiredCameraAngles": [
        "SIDE"
      ],
      "requiredLandmarks": [
        "Hip",
        "Knee",
        "Ankle"
      ],
      "implementationKey": "knee_angle",
      "sourceCriterionCodes": [
        "KNEE_ANGLE"
      ],
      "referenceSourceIds": [
        "ACE_FORWARD_LUNGE"
      ],
      "measurementMethod": {
        "id": "knee_angle",
        "formula": "angle(hip,knee,ankle)",
        "units": "degrees",
        "configurationRef": "measurementConfiguration",
        "outputIsProjected2D": true
      },
      "evaluationMethod": {
        "id": "COACH_APPROVED_POLICY_WITH_VALIDATION_GATE",
        "requiresReviewedCriterion": true,
        "requiresIndependentVideoValidation": true,
        "requiresApplicableVariant": true
      },
      "referenceRangeOrTarget": {
        "kind": "QUALITATIVE_COACHING_REFERENCE",
        "targetKey": null,
        "value": null,
        "universalNumericRange": null
      },
      "thresholdSource": "COACH_REVIEW_PENDING",
      "passCondition": {
        "kind": "COACH_CONDITION_REQUIRED",
        "targetKey": null,
        "description": "Chưa có điều kiện định lượng được Coach phê duyệt cho phạm vi sử dụng."
      },
      "improvementCondition": {
        "kind": "COACH_CONDITION_REQUIRED",
        "description": "Chỉ so điều kiện đã được duyệt; không suy ra từ absence of signal."
      },
      "insufficientDataCondition": [
        "Biến thể không khớp hoặc chưa xác định.",
        "Góc quay không phù hợp hay thay đổi.",
        "Thiếu khớp hoặc mất tracking trong pha cần đo.",
        "Thiếu mục tiêu áp dụng hoặc chưa có policy đã duyệt và kiểm chứng."
      ],
      "evidenceRequirements": {
        "repOrSegment": true,
        "timestampSeconds": true,
        "observedValueAndUnits": true,
        "targetAndProvenanceWhenUsed": true,
        "landmarkCoordinatesAndVisibility": true,
        "modelRuleStandardVersions": true
      },
      "correctionAdvice": {
        "suggestions": [
          "Quay ngang, thấy chân trước và cổ chân xuyên suốt."
        ],
        "retry": "Giữ camera cố định theo góc hỗ trợ và quay lại cùng biến thể để đối chiếu.",
        "coachReviewWhen": "Có đau, mất kiểm soát, dấu hiệu lặp lại hoặc cần đổi mục tiêu: dừng và nhờ người chuyên môn xem trực tiếp.",
        "referenceSourceIds": [
          "ACE_FORWARD_LUNGE"
        ],
        "approvalStatus": "SOURCE_INFORMED_REVIEW_PENDING"
      },
      "limitations": [
        "Hình chiếu 2D chịu ảnh hưởng phối cảnh, vóc dáng và độ chính xác landmark.",
        "Không suy ra lực, kích hoạt cơ, áp lực khớp, chẩn đoán hoặc mức an toàn tuyệt đối."
      ],
      "validationStatus": "EXPERIMENTAL_NOT_COACH_VALIDATED",
      "evaluationPolicy": {
        "status": "EXPERIMENTAL",
        "approvedByCoach": null,
        "approvedAt": null,
        "approvedStandardDigest": null,
        "validationReport": null,
        "passCondition": null,
        "improvementCondition": null
      }
    },
    {
      "criterionId": "LUNGE-02",
      "criterionName": "Góc thân quan sát",
      "type": "C",
      "description": "Đo thay đổi thân; chưa kết luận mất thăng bằng.",
      "applicableExerciseVariants": [
        "FORWARD_BODYWEIGHT"
      ],
      "requiredCameraAngles": [
        "SIDE"
      ],
      "requiredLandmarks": [
        "Shoulder",
        "Hip",
        "Knee"
      ],
      "implementationKey": "torso_angle",
      "sourceCriterionCodes": [
        "TORSO_ANGLE"
      ],
      "referenceSourceIds": [
        "ACE_FORWARD_LUNGE"
      ],
      "measurementMethod": {
        "id": "torso_angle",
        "formula": "angle(shoulder,hip,knee)",
        "units": "degrees",
        "configurationRef": "measurementConfiguration",
        "outputIsProjected2D": true
      },
      "evaluationMethod": {
        "id": "COACH_APPROVED_POLICY_WITH_VALIDATION_GATE",
        "requiresReviewedCriterion": true,
        "requiresIndependentVideoValidation": true,
        "requiresApplicableVariant": true
      },
      "referenceRangeOrTarget": {
        "kind": "QUALITATIVE_COACHING_REFERENCE",
        "targetKey": null,
        "value": null,
        "universalNumericRange": null
      },
      "thresholdSource": "COACH_REVIEW_PENDING",
      "passCondition": {
        "kind": "COACH_CONDITION_REQUIRED",
        "targetKey": null,
        "description": "Chưa có điều kiện định lượng được Coach phê duyệt cho phạm vi sử dụng."
      },
      "improvementCondition": {
        "kind": "COACH_CONDITION_REQUIRED",
        "description": "Chỉ so điều kiện đã được duyệt; không suy ra từ absence of signal."
      },
      "insufficientDataCondition": [
        "Biến thể không khớp hoặc chưa xác định.",
        "Góc quay không phù hợp hay thay đổi.",
        "Thiếu khớp hoặc mất tracking trong pha cần đo.",
        "Thiếu mục tiêu áp dụng hoặc chưa có policy đã duyệt và kiểm chứng."
      ],
      "evidenceRequirements": {
        "repOrSegment": true,
        "timestampSeconds": true,
        "observedValueAndUnits": true,
        "targetAndProvenanceWhenUsed": true,
        "landmarkCoordinatesAndVisibility": true,
        "modelRuleStandardVersions": true
      },
      "correctionAdvice": {
        "suggestions": [
          "Thử kiểm soát hạ hông và đối chiếu thân theo từng pha."
        ],
        "retry": "Giữ camera cố định theo góc hỗ trợ và quay lại cùng biến thể để đối chiếu.",
        "coachReviewWhen": "Có đau, mất kiểm soát, dấu hiệu lặp lại hoặc cần đổi mục tiêu: dừng và nhờ người chuyên môn xem trực tiếp.",
        "referenceSourceIds": [
          "ACE_FORWARD_LUNGE"
        ],
        "approvalStatus": "SOURCE_INFORMED_REVIEW_PENDING"
      },
      "limitations": [
        "Hình chiếu 2D chịu ảnh hưởng phối cảnh, vóc dáng và độ chính xác landmark.",
        "Không suy ra lực, kích hoạt cơ, áp lực khớp, chẩn đoán hoặc mức an toàn tuyệt đối."
      ],
      "validationStatus": "EXPERIMENTAL_NOT_COACH_VALIDATED",
      "evaluationPolicy": {
        "status": "EXPERIMENTAL",
        "approvedByCoach": null,
        "approvedAt": null,
        "approvedStandardDigest": null,
        "validationReport": null,
        "passCondition": null,
        "improvementCondition": null
      }
    }
  ],
  "measurementConfiguration": {
    "source": "IMPLEMENTATION_CONFIGURATION",
    "coordinateSystem": "NORMALIZED_IMAGE_TO_PIXEL_2D",
    "visibilityThreshold": 0.65,
    "sampleRateHz": 10,
    "visibilityMeaning": "landmark visibility, not probability of correct technique",
    "version": "pose-measurement-1"
  },
  "algorithmThresholds": {
    "source": "EXPERIMENTAL_ALGORITHM_CONFIGURATION",
    "configurationRef": "exercise-specific measurement adapter",
    "scientificallyValidatedTechniqueStandard": false,
    "changesRequireRegressionTests": true
  },
  "individualTrainingTargetSchema": {
    "source": "COACH_WORKOUT_PLAN_OR_EXPLICIT_USER_TARGET",
    "targetsRequire": [
      "value",
      "units",
      "exerciseVariant",
      "source",
      "configuredBy",
      "configuredAt"
    ],
    "defaults": null,
    "interpretFreeTextNotesAutomatically": false
  },
  "history": [
    {
      "version": "forward-lunge-1.0.0-draft",
      "createdAt": "2026-10-31",
      "status": "DRAFT",
      "changeReason": "First source-informed reference; pending qualified Coach review and labeled-video validation."
    }
  ]
}
