{
  "schemaVersion": 1,
  "exerciseId": "PLANK",
  "exerciseName": "Front Plank",
  "exerciseVariant": "FRONT",
  "equipment": [
    "MAT_OPTIONAL"
  ],
  "trainingLevel": "COACH_ADAPTED",
  "referenceSources": [
    {
      "sourceId": "ACE_FRONT_PLANK",
      "title": "ACE Front Plank",
      "url": "https://www.acefitness.org/resources/everyone/exercise-library/32/front-plank/",
      "publisher": "American Council on Exercise",
      "accessedAt": "2026-10-31",
      "summary": "Tham chiếu giữ thân và chân ổn định, vai đặt trên khuỷu rồi hạ người có kiểm soát. Thời gian giữ và khả năng thực hiện cần phù hợp từng người.",
      "scope": "EXERCISE_COACHING_REFERENCE",
      "providesValidatedComputerVisionThresholds": false
    },
    {
      "sourceId": "MEDIAPIPE_POSE",
      "title": "Pose landmark detection guide",
      "url": "https://developers.google.com/edge/mediapipe/solutions/vision/pose_landmarker",
      "publisher": "Google AI Edge",
      "accessedAt": "2026-10-31",
      "summary": "Pose Landmarker dự đoán vị trí khớp theo ảnh/video; output không tự xác nhận kỹ thuật hay lực lên khớp.",
      "scope": "MEASUREMENT_TECHNOLOGY_NOT_TECHNIQUE_STANDARD",
      "providesValidatedComputerVisionThresholds": false
    }
  ],
  "approvedByCoach": null,
  "approvedAt": null,
  "approvedStandardDigest": null,
  "standardVersion": "front-plank-1.0.0-draft",
  "status": "EXPERIMENTAL",
  "startingPosition": {
    "reference": "Chống khuỷu trong biến thể plank trước, thấy vai, khuỷu, hông và cổ chân.",
    "requiredLandmarks": [
      "Ankle",
      "Hip",
      "Shoulder"
    ],
    "detectionConditions": [
      "Nhận diện từ đoạn frame liên tục phù hợp, không chỉ frame đầu.",
      "Tách điều kiện khởi tạo đo với điều kiện kết luận kỹ thuật."
    ]
  },
  "movementPhases": [
    {
      "phaseId": "PREPARE",
      "description": "Vào tư thế chống khuỷu."
    },
    {
      "phaseId": "HOLD",
      "description": "Khoảng giữ liên tục có đủ khớp."
    },
    {
      "phaseId": "FINISH",
      "description": "Hạ người có kiểm soát."
    }
  ],
  "criteria": [
    {
      "criterionId": "PLANK-01",
      "criterionName": "Đường thân trong khoảng giữ",
      "type": "C",
      "description": "Đo đường thân qua thời gian, không chẩn đoán võng lưng.",
      "applicableExerciseVariants": [
        "FRONT"
      ],
      "requiredCameraAngles": [
        "SIDE"
      ],
      "requiredLandmarks": [
        "Shoulder",
        "Hip",
        "Ankle"
      ],
      "implementationKey": "body_alignment",
      "sourceCriterionCodes": [
        "BODY_ALIGNMENT"
      ],
      "referenceSourceIds": [
        "ACE_FRONT_PLANK"
      ],
      "measurementMethod": {
        "id": "body_alignment",
        "formula": "angle(shoulder,hip,ankle)",
        "units": "degrees",
        "configurationRef": "measurementConfiguration",
        "outputIsProjected2D": true
      },
      "evaluationMethod": {
        "id": "COACH_APPROVED_POLICY_WITH_VALIDATION_GATE",
        "requiresReviewedCriterion": true,
        "requiresIndependentVideoValidation": true,
        "requiresApplicableVariant": true
      },
      "referenceRangeOrTarget": {
        "kind": "QUALITATIVE_COACHING_REFERENCE",
        "targetKey": null,
        "value": null,
        "universalNumericRange": null
      },
      "thresholdSource": "COACH_REVIEW_PENDING",
      "passCondition": {
        "kind": "COACH_CONDITION_REQUIRED",
        "targetKey": null,
        "description": "Chưa có điều kiện định lượng được Coach phê duyệt cho phạm vi sử dụng."
      },
      "improvementCondition": {
        "kind": "COACH_CONDITION_REQUIRED",
        "description": "Chỉ so điều kiện đã được duyệt; không suy ra từ absence of signal."
      },
      "insufficientDataCondition": [
        "Biến thể không khớp hoặc chưa xác định.",
        "Góc quay không phù hợp hay thay đổi.",
        "Thiếu khớp hoặc mất tracking trong pha cần đo.",
        "Thiếu mục tiêu áp dụng hoặc chưa có policy đã duyệt và kiểm chứng."
      ],
      "evidenceRequirements": {
        "repOrSegment": true,
        "timestampSeconds": true,
        "observedValueAndUnits": true,
        "targetAndProvenanceWhenUsed": true,
        "landmarkCoordinatesAndVisibility": true,
        "modelRuleStandardVersions": true
      },
      "correctionAdvice": {
        "suggestions": [
          "Giữ camera ngang và khung hình trọn vai đến chân."
        ],
        "retry": "Giữ camera cố định theo góc hỗ trợ và quay lại cùng biến thể để đối chiếu.",
        "coachReviewWhen": "Có đau, mất kiểm soát, dấu hiệu lặp lại hoặc cần đổi mục tiêu: dừng và nhờ người chuyên môn xem trực tiếp.",
        "referenceSourceIds": [
          "ACE_FRONT_PLANK"
        ],
        "approvalStatus": "SOURCE_INFORMED_REVIEW_PENDING"
      },
      "limitations": [
        "Hình chiếu 2D chịu ảnh hưởng phối cảnh, vóc dáng và độ chính xác landmark.",
        "Không suy ra lực, kích hoạt cơ, áp lực khớp, chẩn đoán hoặc mức an toàn tuyệt đối."
      ],
      "validationStatus": "EXPERIMENTAL_NOT_COACH_VALIDATED",
      "evaluationPolicy": {
        "status": "EXPERIMENTAL",
        "approvedByCoach": null,
        "approvedAt": null,
        "approvedStandardDigest": null,
        "validationReport": null,
        "passCondition": null,
        "improvementCondition": null
      }
    },
    {
      "criterionId": "PLANK-02",
      "criterionName": "Vị trí hông trên ảnh",
      "type": "C",
      "description": "Đo độ lệch hông trên ảnh; góc camera ảnh hưởng độ lệch.",
      "applicableExerciseVariants": [
        "FRONT"
      ],
      "requiredCameraAngles": [
        "SIDE"
      ],
      "requiredLandmarks": [
        "Shoulder",
        "Hip",
        "Ankle"
      ],
      "implementationKey": "hip_height",
      "sourceCriterionCodes": [
        "HIP_HEIGHT"
      ],
      "referenceSourceIds": [
        "ACE_FRONT_PLANK"
      ],
      "measurementMethod": {
        "id": "hip_height",
        "formula": "signed hip offset from shoulder-ankle line / projected_body_length",
        "units": "body_lengths",
        "configurationRef": "measurementConfiguration",
        "outputIsProjected2D": true
      },
      "evaluationMethod": {
        "id": "COACH_APPROVED_POLICY_WITH_VALIDATION_GATE",
        "requiresReviewedCriterion": true,
        "requiresIndependentVideoValidation": true,
        "requiresApplicableVariant": true
      },
      "referenceRangeOrTarget": {
        "kind": "QUALITATIVE_COACHING_REFERENCE",
        "targetKey": null,
        "value": null,
        "universalNumericRange": null
      },
      "thresholdSource": "COACH_REVIEW_PENDING",
      "passCondition": {
        "kind": "COACH_CONDITION_REQUIRED",
        "targetKey": null,
        "description": "Chưa có điều kiện định lượng được Coach phê duyệt cho phạm vi sử dụng."
      },
      "improvementCondition": {
        "kind": "COACH_CONDITION_REQUIRED",
        "description": "Chỉ so điều kiện đã được duyệt; không suy ra từ absence of signal."
      },
      "insufficientDataCondition": [
        "Biến thể không khớp hoặc chưa xác định.",
        "Góc quay không phù hợp hay thay đổi.",
        "Thiếu khớp hoặc mất tracking trong pha cần đo.",
        "Thiếu mục tiêu áp dụng hoặc chưa có policy đã duyệt và kiểm chứng."
      ],
      "evidenceRequirements": {
        "repOrSegment": true,
        "timestampSeconds": true,
        "observedValueAndUnits": true,
        "targetAndProvenanceWhenUsed": true,
        "landmarkCoordinatesAndVisibility": true,
        "modelRuleStandardVersions": true
      },
      "correctionAdvice": {
        "suggestions": [
          "Thử giữ hông ổn định và nhờ Coach đối chiếu cùng góc quay."
        ],
        "retry": "Giữ camera cố định theo góc hỗ trợ và quay lại cùng biến thể để đối chiếu.",
        "coachReviewWhen": "Có đau, mất kiểm soát, dấu hiệu lặp lại hoặc cần đổi mục tiêu: dừng và nhờ người chuyên môn xem trực tiếp.",
        "referenceSourceIds": [
          "ACE_FRONT_PLANK"
        ],
        "approvalStatus": "SOURCE_INFORMED_REVIEW_PENDING"
      },
      "limitations": [
        "Hình chiếu 2D chịu ảnh hưởng phối cảnh, vóc dáng và độ chính xác landmark.",
        "Không suy ra lực, kích hoạt cơ, áp lực khớp, chẩn đoán hoặc mức an toàn tuyệt đối."
      ],
      "validationStatus": "EXPERIMENTAL_NOT_COACH_VALIDATED",
      "evaluationPolicy": {
        "status": "EXPERIMENTAL",
        "approvedByCoach": null,
        "approvedAt": null,
        "approvedStandardDigest": null,
        "validationReport": null,
        "passCondition": null,
        "improvementCondition": null
      }
    }
  ],
  "measurementConfiguration": {
    "source": "IMPLEMENTATION_CONFIGURATION",
    "coordinateSystem": "NORMALIZED_IMAGE_TO_PIXEL_2D",
    "visibilityThreshold": 0.65,
    "sampleRateHz": 10,
    "visibilityMeaning": "landmark visibility, not probability of correct technique",
    "version": "pose-measurement-1"
  },
  "algorithmThresholds": {
    "source": "EXPERIMENTAL_ALGORITHM_CONFIGURATION",
    "configurationRef": "exercise-specific measurement adapter",
    "scientificallyValidatedTechniqueStandard": false,
    "changesRequireRegressionTests": true
  },
  "individualTrainingTargetSchema": {
    "source": "COACH_WORKOUT_PLAN_OR_EXPLICIT_USER_TARGET",
    "targetsRequire": [
      "value",
      "units",
      "exerciseVariant",
      "source",
      "configuredBy",
      "configuredAt"
    ],
    "defaults": null,
    "interpretFreeTextNotesAutomatically": false
  },
  "history": [
    {
      "version": "front-plank-1.0.0-draft",
      "createdAt": "2026-10-31",
      "status": "DRAFT",
      "changeReason": "First source-informed reference; pending qualified Coach review and labeled-video validation."
    }
  ]
}
